class,argtype,text,argtypetext,argtypetextstart,argtypetextend1,4,"Camping can take on many definitions. Camping to one person can mean seclusion in the middle of a forest. Another individual might think camping as a motor home with all the amenities of their house, including the kitchen sink. Whatever the definition is, camping is an experience that should be tried by everyone.",A small weekend away from these luxuries can make the campers realize how lucky they are in their day to day living,5366,5481
1,2,"The last 50 years have seen an increasing number of immigrants to other countries. People moved due to a number of reasons, namely better educations or higher salary jobs. Some people thought that they should follow the local customs in order to integrate into their adopted countries’ cultures. However I strongly believe that they are able to sustain their cultural identities and doing so help they keep their origin values.","In this new environment, parent should find friends coming from their same country so that they can socialize in a very familiar manner as feeling being home",1414,1571
1,2,"Why shouldn't schools do locker checks? Why do many students oppose locker checks? Random locker checks are not done to torment and/or invade the privacy of the students, but for many other important reasons which include school security. These checks are required because malicious students bring drugs and weapons to school and store them in the lockers. Random locker checks should be made obligatory and done frequently to assure the wellbeing of the students.",drugs induce immense physical damage and when it is overdosed drugs can lead to death,1412,1497
1,2,"Over the last half century the change in the life of human begings has increased beyond our wildest expectations. There are countless new technological equipments flooding into our lives, such as the Internet, television and cell phone. They all enrich our daily lives.Now, many students learn from Internet after class and they find it quite helpful.","Students have knowledge of others cultrues, outer space etc",1433,1492
1,4,"Despite the development of modern society, the health care and education still remain the basic rights of citizens. And a much debated issue these days is whether or not the government should be responsible for citizens' health care and education.",it is a waste of public money for the government to subsidize health care and education of each citizen in society,1207,1321
1,2,"Many people believe that children should study at school to have more knowledge that prepare better for their future. Others, however, think that these children may disrupt their school work and should be allowed to leave school early to find a job. Personally, I tend to agree with the point of view that student have to be forced to study at school.",employer always prefer to hire an employee of high degree who have professional skills,941,1027
1,2,"Today, close circuit television (CCTV) cameras are widely used in a variety of circumstances. They are used in schools, businesses and some other premises in order to monitor the activities taking place. It is undeniable that the use of CCTV has plenty of benefits to offer, especially in reducing crimes and protecting the employees in a premise. Nevertheless, some argue that these cameras invade their privacies due to constantly being monitored. Even so, I strongly believe that CCTV cameras should be installed in every premise to combat the ever increasing theft rate and to protect the workers at the workplace.","when a shop is attacked by thieves, the clips taken by these cameras serve as a source of evidence to help the thieves to be traced",746,877
1,2,"The introduction of email and text messaging has brought about considerable changes in communication. With this situation, some people believe that they may be factors decreasing the position of written language. I am in favor of that idea because of their advantages and the fact we can see today about the use of these new means.","Such ways usually made people have troubles for the expensiveness, difficulties in far communication or emergency and the loss of information",667,808
1,2,"The internet has been more and more popular for recent years, providing people with a huge source of information. As a result of this, print media such as newspapers have experienced a dramatic decline in the number of readers. Some people, however, still believe that they can exist for long time; others disagree, arguing that newspapers have lost their competitive advantage to sustain their prolonged existence. Personally, I am inclined to agree with the latter view for following reasons.","to obtain information, using the internet is quicker and more convenient than reading newspapers",554,650
1,2,"The differences between knowledge from books and from experience have erupted endless controversy. Various ideas and preferences have been presented. The purpose of my writing is to deeply discuss these sources of knowledge in two important aspects: accuracy and practicability, and to show my greater interest in knowledge accumulated from experience.",knowledge acquired from books is greatly accepted,607,656
1,4,"In this world, there is no one who does not know this world 'globalization', which means the world are more closer, and every single countries affects each other more than before in many ways. That is why governmental and non-governmental organizations have been focus on being harmony and contribute to aid to poor countries. It is true that just giving aid to impoverished countries could be manipulated by big power countries. In addition, a great amount of materials and money have poor countries being corrupted and politically dependent on other countries.",being a global neighbor by aiding poor countries would be continues by many organizations and volunteers,2322,2426
1,4,"There is not a single piece of history that determines whether or not same sex marriage is right or wrong. There is absolutely no legal, logical, or governing reason that same sex couples cannot be wed and it's extremely unconstitutional in every way to tell them they can't. Same sex marriage should be legal for a number of reasons, a few being, it's no one else's business if two men or two women want to get married, not allowing them to marry makes them seem inferior, and it rids them of their civil rights.",One day in the future this will be achieved,4053,4096
1,2,"Nowadays men and women are equally participating in every field. Contrastingly, in the past time, women worked at home and performed sophisticated work. This factor is still affecting thinking of many people. They still believe that in present time women must do such type of work only. This tendency enforces universities to accept student according to the gender.",in present time women must do such type of work only,274,326
1,2,"In our modern times, with the development of science and technology, our living standard has been improved beyond recognition. Technology, however, is not the best solution to all the world's intricate problems. Accordingly, it is believed that we need to place less emphasis on technological solutions and more on other values, such as economy, politics and education. Personally, I partly disagree with this point of view, and the reasons are given below.",a lot of people spend too much time using hi-tech devices nowadays,1290,1356
1,2,"Camping can take on many definitions. Camping to one person can mean seclusion in the middle of a forest. Another individual might think camping as a motor home with all the amenities of their house, including the kitchen sink. Whatever the definition is, camping is an experience that should be tried by everyone.",Breathing the country air usually makes a person feel revitalized,973,1038
1,2,"Today, close circuit television (CCTV) cameras are widely used in a variety of circumstances. They are used in schools, businesses and some other premises in order to monitor the activities taking place. It is undeniable that the use of CCTV has plenty of benefits to offer, especially in reducing crimes and protecting the employees in a premise. Nevertheless, some argue that these cameras invade their privacies due to constantly being monitored. Even so, I strongly believe that CCTV cameras should be installed in every premise to combat the ever increasing theft rate and to protect the workers at the workplace.",prevention is always better than suffering from the consequences,2187,2251
1,2,"Preserving wild animals in zoos is an issue which frequently generates a great deal of heated debate, with supporters maintaining that wild life would be taken good care from professionals, while opponents claim that the animals are deprived of freedom as a result of staying in zoos. From my perspective, animals should live in natural habitats instead of zoos.",wild life would be taken good care from professionals,182,235
1,2,"Today, we no longer fear any contagious diseases, kudos to modern technology and medical advancement. However, it is the contagious behaviors such as addiction and the wrong abuse of drugs that continue to terrorize our society, especially the young ones. It is undeniable that drug addiction is indeed on the rise and effective solutions must be taken in order to trim down the number of drug addicts. Some suggest that it would be better if those caught red-handed using drugs be imprisoned. In my opinion, I disagree to the aforementioned resolution due to the reasons that I will put forward below.","once they return to the society, they tend to relapse and get involved in drugs again",779,864
1,4,"Studies are an essential part of life.Some countries permit students to take a break from studies between high school and university studies, while in some countries, it is considered as waste of time. However, a break of one year is good for young people after finishing their high school.",A relaxation of one year to young minds will give them a quintessential change,441,519
1,4,"Preserving wild animals in zoos is an issue which frequently generates a great deal of heated debate, with supporters maintaining that wild life would be taken good care from professionals, while opponents claim that the animals are deprived of freedom as a result of staying in zoos. From my perspective, animals should live in natural habitats instead of zoos.",zoos are more likely to be a killer rather than a protector in protecting wild lives,1107,1191
1,2,"For many centuries, outer space has been one of the most favourable realms of study. Space expeditions have been launched and many have been successful. However, a lot of people still consider space exploration as an act of wasting money, to illustrate, astronauts only brought useless rocks back to planet earth despite the large sum of money spent on their equipment. On the other hand, there are some reasons for human beings to travel to outer space.","In spite of costing a fortune, space exploration has given aforementioned benefits",1585,1667
1,2,"Why shouldn't schools do locker checks? Why do many students oppose locker checks? Random locker checks are not done to torment and/or invade the privacy of the students, but for many other important reasons which include school security. These checks are required because malicious students bring drugs and weapons to school and store them in the lockers. Random locker checks should be made obligatory and done frequently to assure the wellbeing of the students.","Drugs, alcohol, and firearms in lockers make a harmless place like school quite dangerous",615,704
1,2,"It is quite common that more and more people can watch exhibitions through television or internet at home due to modern technology; therefore, some people think museums and art galleries will disappear soon. Although modern technology make it possible, I still believe some museums and art galleries will not disappear.",museums and art galleries preserve some culture heritages,1190,1247
1,2,"Why shouldn't schools do locker checks? Why do many students oppose locker checks? Random locker checks are not done to torment and/or invade the privacy of the students, but for many other important reasons which include school security. These checks are required because malicious students bring drugs and weapons to school and store them in the lockers. Random locker checks should be made obligatory and done frequently to assure the wellbeing of the students.",The students who are yet to be caught will learn from the mistakes of other students and will stop,1909,2007
1,4,"Why shouldn't schools do locker checks? Why do many students oppose locker checks? Random locker checks are not done to torment and/or invade the privacy of the students, but for many other important reasons which include school security. These checks are required because malicious students bring drugs and weapons to school and store them in the lockers. Random locker checks should be made obligatory and done frequently to assure the wellbeing of the students.",more students will comply with the school policies,1758,1808
1,4,"The purpose of this essay is to discuss what can students and the organizations benefit from the activity that the students sent by their schools to work for companies without salaries. In this essay, I would start by analyzing the advantages for doing this for both students and companies, and then I would draw a conclusion at the end.",students can learn outside the textbook and classroom with a real working experiences that can be a great opportunity for future job consideration whereas organizations earn much more,1389,1572
1,2,"Nowadays, the importance of vehicles has been widely recognized thoughout the world. However, it rises concerns about the increasingly severe traffic problems as well as the automobile exhaust pollution. Some argue that the best solution to these issues is raising the price of petrol. From my perspective, I think their view is overly simplistic.","Due to the increasing number of petrol stations, the competition in this field is more and more fierce",512,614
1,4,"Primary and secondary education provide a basic knowledge and skills to the people in this world. I completely agree that government should provide those education to their people; however, for the more higher education like university, the students or their parents should pay for the fees.",this will encourage all the parents to think of the way to help their children to achieve more in their lives,1123,1232
1,2,"A matter of considerable controversy at present is the issue of whether developments in agriculture are beneficial to humankind, or rather these developments should be allowed to die out just as many inappropriate innovations have in the past. From my perspective, these developments in agricultures should be preserved for the sake of the benefits of all human beings.",Imagine the tragedies that would ensue if people lived in famine and started to eat people to survive,616,717
1,2,The soaring crime rate has led to the proposal that it is time for the government to take action to control the proliferation of violent scenes in media.,"It is recently reported in the news that a seventeen-year-old boy killed all his family members, one sister and two parents out of hatred and jealousy",1014,1164
1,4,"Universities have quickly become the places to go when people seek to further develop their expertise. Whether this really suits the needs of their potential employers is highly unlikely as universities nowadays have evolved as a domain of experts: where more and more is known about less and less. Nevertheless, among the vast range of choices offered there are often some training courses that have direct implications on job-seeking and other aspects in everyday life. However, although I respect the universities' aim of providing such courses to develop skills required for work and support their cause, I do not believe it is the main or best function of a university.",I do not believe it is the main or best function of a university,640,704
1,2,"Many people believe that children should study at school to have more knowledge that prepare better for their future. Others, however, think that these children may disrupt their school work and should be allowed to leave school early to find a job. Personally, I tend to agree with the point of view that student have to be forced to study at school.",schools provide lots of academic knowledge to students,680,734
1,2,"Nowadays, thanks to the development of technology, computer is now indispensable to life. Some people think that computer is good for children and it should be used daily by children but some others think differently. In my opinion, the latter opinion is true.",computer should be used not only for entertaining but also for working and studying purpose,1612,1703
1,4,"Personally, I believe that married women nowadays have right to take up jobs like men when employment discrimination based on gender have been erased significantly. Working outside home will bring a lot of benefits to both married woman and their household. I will mention some basic reasons as following.",married women nowadays have right to take up jobs like men,76,134
1,2,"It is quite common that more and more people can watch exhibitions through television or internet at home due to modern technology; therefore, some people think museums and art galleries will disappear soon. Although modern technology make it possible, I still believe some museums and art galleries will not disappear.",authentic exhibits cannot be completely displayed only by images and videos,935,1010
1,4,"Many people believe that the life in a major metropolis is convenient and interesting. Personally, however, I am in favor of living in a small town. The atmosphere in suburban area brings me peaceful feeling. Moreover, people there are very friendly. Finally, the environmental is greener than in cities. That is why I love enjoying my life in a small town.",These features make a suburban town the paradise for people who want to escape from suffocating lives in major cities,724,841
1,2,"It is every student's desire to study at a good university and experience a new environment. While some students study and live overseas to achieve this, some prefer to study home because of the difficulties of living and studying overseas. In my opinion, one who studies overseas will gain many skills throughout this experience for several reasons.",those difficulties will turn into valuable experiences in the following steps of life,993,1078
1,2,"Perhaps, no issue in this world is as significant to people as cooking food, because it affects everybody in their daily lives. Some people hold the opinion that people should spend much time on food. However, I do think that people are likely to spend less time in cooking food. There are various reasons why I maintain this viewpoint, and among those reasons are two important ones.","Even they have some spare time, they prefer to go out with friends to relax and relieve the pressure from work and study",1704,1824
1,4,"Perhaps, no issue in this world is as significant to people as cooking food, because it affects everybody in their daily lives. Some people hold the opinion that people should spend much time on food. However, I do think that people are likely to spend less time in cooking food. There are various reasons why I maintain this viewpoint, and among those reasons are two important ones.",people will spend less time in cooking food,2790,2833
1,4,"Studies are an essential part of life.Some countries permit students to take a break from studies between high school and university studies, while in some countries, it is considered as waste of time. However, a break of one year is good for young people after finishing their high school.",Some students even utilise this time for preparation of their desired university course,1263,1350
1,2,"Nowadays, more and more people begin to select prepared food as their daily meals, since it can effectively save time which is considered as money in our modern society. However it is obvious that cooked food can bring about some negative influence result from utilizing the artificial ingredients, ignoring the nutrition of food and modifying people's eating habits. In this essay, I would like to explain why this is not a good thing based on the three reasons above.","cooked food can bring about some negative influence result from utilizing the artificial ingredients, ignoring the nutrition of food and modifying people's eating habits",212,381
1,2,Is marijuana as bad as society makes it out to be? Since the 1930's marijuana has been illegal in the United States. That being said it's somehow America's number one cash crop. Users of the drug aren't the only ones who support cannabis; many of us who do not indulge are pro-legalization because we see that prohibition does more harm than good.,Another group that benefits greatly from prohibition are the drug cartels,1454,1527
1,4,"The topic of nuclear technology frequently generates a heated debate with proponenets maintaining that nuclear power provides a source of efficient and economical energy while opponents argue that atomic technology is uncontrollable and very dangerous to handle. As far as my opinion is concerned , I find myself aligned with opponenets of the usages of nuclear power. I have several reasons to believe its disadvantages outnumber the few advantages.",pursuit of nuclear technology one way or the other leads towards atomic weapons,535,614
1,4,"Despite the development of modern society, the health care and education still remain the basic rights of citizens. And a much debated issue these days is whether or not the government should be responsible for citizens' health care and education.",government should fund the deprived for their health care and education,1699,1770
1,4,"Unemployment is clearly a global problem, be it in developed countries or developing ones. However, I tend to believe it is the responsibility of these disadvantaged citizens, rather than the government, to help them out.",the government ought to set up free vocational trainings or to provide interest-free bank loans for them,1144,1248
1,4,"It is quite common that more and more people can watch exhibitions through television or internet at home due to modern technology; therefore, some people think museums and art galleries will disappear soon. Although modern technology make it possible, I still believe some museums and art galleries will not disappear.",museums and art galleries are necessary to be preserved for its importance of education and culture,1469,1568
1,4,"Games have played a key role in children's growth, especially in terms of their abilities. With technological advances, children have more access to modern games currently. In such case, the relative importance of traditional games and modern games in children's developments of skills has become a frequent topic of discussion. For me, I believe parents and educators should attach more importance to traditional games.",parents and educators should attach more importance to traditional games,414,486
1,4,"With the rapid development of the standard of people's life, increasing numbers of animal experiments are done, new medicines and foods, for instance. Some opponents says that it is cruel to animals and nature, however, I believe that no sensible person will deny that it is a dramatically cruel activity to humanity if the latest foods or medicines are allowed to sold without testing on animals. In my essay, I will discuss this issue from twofold aspects.",it is a dramatically cruel activity to humanity if the latest foods or medicines are allowed to sold without testing on animals,320,447
1,4,"How to allocate governmental budget efficiently has always been a hot topic of discussion among the public. Recently, some people argue that government should invest more on medical care and education rather than on entertaining or sports facilities. As far as I am concerned, this proposal is beneficial more to the society.",this proposal is beneficial more to the society,349,396
1,2,"Creativity is the ability to think beyond the obvious. Many governments restrict the artistic works of the creative minds. Creativity originates in a free mind. Hence, creative artists must be given the freedom to express their ideas without any restrictions.",Many artists have been involved in controversies because of hurting the religious or social beliefs of the common people,1527,1647
1,2,"The purpose of this essay is to discuss what can students and the organizations benefit from the activity that the students sent by their schools to work for companies without salaries. In this essay, I would start by analyzing the advantages for doing this for both students and companies, and then I would draw a conclusion at the end.",they can not only save time and money but also be enlightened by what young people have to say,1576,1670
1,2,"Nowadays, we can see advertisements everywhere, from television set to posters on the streets. Some people believe that these various advertisements get people to buy products that are unnecessary and only look good on television. I tend to agree with this view.",they aim to grab your attention,1211,1242
