class,argtype,text,argtypetext,argtypetextstart,argtypetextend1,4,"The differences between knowledge from books and from experience have erupted endless controversy. Various ideas and preferences have been presented. The purpose of my writing is to deeply discuss these sources of knowledge in two important aspects: accuracy and practicability, and to show my greater interest in knowledge accumulated from experience.",I consider knowledge from experience as the more important source,2163,2228
1,2,"Innovative artists bring enjoyment and inspiration to our sometimes tedious life; however, some people deem that artists have been entrusted with too much freedom and power and should be restricted by the government. It is my personal belief that freedom of expressing thoughts and ideas should always be eulogized and it's rather iniquitous to impose a shackle on artists' will to create.","If the art displays unreality, the public audiences certainly have the acumen to recognise its untruthfulness and only appreciate its art value",919,1062
1,2,"The last 50 years have seen a significant increase in the number of tourist travelling worldwide. While some might think the tourism bring large profit for the destination countries, I would contend that this industry has affected the cultural attributes and damaged the natural environment of the tourist destinations.","As the Australia’s Great Barrier Reef has shown, the billion visitors per annum has generated immense destruction to this nature wonder, namely breaking the corals caused by walking or throwing boat’s anchors, dropping fuel and other sorts of pollutions",1161,1414
1,4,"Never in history was advertising industry so developed as in modern society and it has led to some adverse sentiments in public because some deliver exaggerated and fake information. Hence whether we should ban all the advertisements or not has aroused much controversy of the public. My view is that while some of them are disturbing, we can not overlook other merits the advertisements bring.",we can not overlook other merits the advertisements bring,378,435
1,4,"Nowadays, the popularity of mobile phones has brought about a lot of convenience but at the meanwhile a variety of problems as well, such as social, medical and technical problems. However, I do not think these disadvantages will outweigh the advantages brought by cell phones. In this essay, I would like to analyse these three issues in order to support my viewpoint.",the mobile phone has become a dispensable multifunctional tools in people's daily life,1553,1639
1,4,The increasing population and the technological advancements demand more energy than in the past. It is believed that there are various other resources such as the nuclear and solar which are abundant and eco-friendly. I will analyze these areas in the essay.,it would be a better implication by the government to promote other sources of energy,1340,1425
1,4,"Nowadays men and women are equally participating in every field. Contrastingly, in the past time, women worked at home and performed sophisticated work. This factor is still affecting thinking of many people. They still believe that in present time women must do such type of work only. This tendency enforces universities to accept student according to the gender.",Universities should accept equal numbers of students of both genders,407,475
1,2,"Games have played a key role in children's growth, especially in terms of their abilities. With technological advances, children have more access to modern games currently. In such case, the relative importance of traditional games and modern games in children's developments of skills has become a frequent topic of discussion. For me, I believe parents and educators should attach more importance to traditional games.",communicating with a variety of people will not be an issue for these children any more,1500,1587
1,4,Is marijuana as bad as society makes it out to be? Since the 1930's marijuana has been illegal in the United States. That being said it's somehow America's number one cash crop. Users of the drug aren't the only ones who support cannabis; many of us who do not indulge are pro-legalization because we see that prohibition does more harm than good.,marijuana is physically unhealthy for you and that's why it's illegal,1734,1803
1,2,"In present day and age, students are normally exposed to extra jobs as early as they start their university. This phenomenon, although in some extents, are proved to have negative effects, I feel strongly that the disadvantages are far outweighed by the advantages. In this essay, some of the benefits surrounding this matter will be carefully explained.",students can gain their practical experience by getting involved extra jobs,425,500
1,2,"Studies are an essential part of life.Some countries permit students to take a break from studies between high school and university studies, while in some countries, it is considered as waste of time. However, a break of one year is good for young people after finishing their high school.","When he started his university studies, he failed miserably",1702,1761
1,4,"The modern society is full of cut-throat competition. Some people think that inculcating co-operative approach in a child is essential while some think that competing is the best way to succeed. However, co-operative approach always helps a child to become a responsible adult with good moral values and a friendly social circle.",co-operative approach always helps a child to become a responsible adult with good moral values and a friendly social circle,249,373
1,2,"As we read newspapers or watch TV, we have always been attracted by environmental problems such as traffic issues, air and water pollution questions. Initiatives should be taken to address the specific problems. As the impacts for those pollution and traffic issues are extremely far-reaching, it is insufficient to increase the petrol price only to solve problems, though it is a promising method discussed in the contemporary society.","in the long run, it would be a wise choice",1898,1940
1,2,"Children tend to visit zoos where various kinds of wild creatures could be seen. When it comes to whether zoos should exist on contemporary society, animal-right activists strongly recommended that wildlife belong to natural environment and zoos should be banned. I would not go along with their viewpoint as zoos have irreplaceable benefits in terms of animal preservation and children education.",children could acquire the information regarding how to protect wild animals according to guided tour or volunteers,1347,1462
1,2,"Everyday, companies offer a huge number of different products to consumers. The most effective way to convince consumers to purchase a product is through advertising. However, it is not sufficient in itself. The product also should satisfy the needs of the consumers. In my opinion, advertising is the major reason for high sales of a product for several reasons.",Advertisement is the most effective way to create a well-known product,1097,1167
1,2,"Many people believe that the life in a major metropolis is convenient and interesting. Personally, however, I am in favor of living in a small town. The atmosphere in suburban area brings me peaceful feeling. Moreover, people there are very friendly. Finally, the environmental is greener than in cities. That is why I love enjoying my life in a small town.",The atmosphere in suburban area brings me peaceful feeling,200,258
1,2,"Gun is definitely not a kind of normal good in our society, which is strictly controlled in most countries. However, gun control in some countries is relatively loose than others. Therefore, this is still a controversial topic around the world. From my point of view, it is sensible to enforce the gun control.","in American, young adults and even juveniles can get access to guns, which leads to the tragedies of school gun shooting",938,1058
1,2,"Unemployment is clearly a global problem, be it in developed countries or developing ones. However, I tend to believe it is the responsibility of these disadvantaged citizens, rather than the government, to help them out.",the government should provide help for the disadvantaged people,1454,1517
1,2,"Nowadays men and women are equally participating in every field. Contrastingly, in the past time, women worked at home and performed sophisticated work. This factor is still affecting thinking of many people. They still believe that in present time women must do such type of work only. This tendency enforces universities to accept student according to the gender.",employers need male candidates for the heavy work such as repairing and installation of heavy machine,1110,1211
1,2,"Today, close circuit television (CCTV) cameras are widely used in a variety of circumstances. They are used in schools, businesses and some other premises in order to monitor the activities taking place. It is undeniable that the use of CCTV has plenty of benefits to offer, especially in reducing crimes and protecting the employees in a premise. Nevertheless, some argue that these cameras invade their privacies due to constantly being monitored. Even so, I strongly believe that CCTV cameras should be installed in every premise to combat the ever increasing theft rate and to protect the workers at the workplace.","In the event of an argument, the videotapes can used to determine what actually took place and further actions can be then taken",1665,1793
1,2,"As people have raised their democratic awareness in recent years, they are caring more about how the tax expenditure is distributed by the government. As a result, some people suggest that the tax money should be allocated to publically beneficial services instead of arts. However, from my perspective, I think arts are supposed to be included in the government's investment as well.","Without arts, people would be at risk of suffering psychological problems",1431,1504
1,2,"Since the time they were introduced zoos have both been supported and criticized. Many believe that zoos could be very entertaining and ecologically important, whereas, others think that keeping animals in captivity is totally wrong. Both sides will be discussed before a reasonable conclusion is drawn.",Zoos provide educational information about the lives of different animals to the public,1296,1383
1,4,"A matter of considerable controversy at present is the issue of whether distance-learning should be promoted as much as possible, or rather attending lectures in person should be allowed to take a predominant place in universities because this way of learning is superior than online degrees. From my perspective, online-teaching should be widely used among colleges and universities in terms of convenience and optimizing cost for educational institutions.",distance-learning brings significant convenience for students in every corner of the world,523,613
1,4,"Creativity is the ability to think beyond the obvious. Many governments restrict the artistic works of the creative minds. Creativity originates in a free mind. Hence, creative artists must be given the freedom to express their ideas without any restrictions.",This type of approach is a hurdle in promoting creative minds,1014,1075
1,4,"For many centuries, outer space has been one of the most favourable realms of study. Space expeditions have been launched and many have been successful. However, a lot of people still consider space exploration as an act of wasting money, to illustrate, astronauts only brought useless rocks back to planet earth despite the large sum of money spent on their equipment. On the other hand, there are some reasons for human beings to travel to outer space.",a lot of people still consider space exploration as an act of wasting money,210,285
1,2,"Nowadays, whether to establish large factories nearby housing areas has become a controversial issue in our society. Out of the case of economic development, industrial buildings are a necessary part of modern society. However a vast number of people are against building a factory near their community because of pollution. From my point of view, the advantages of building a factory will outweigh its disadvantages, if we tackle the environmental problems brought by factories.","the factory is not isolated, other industries and business will be quickly established, resulting in economic growth of local area",726,856
1,2,"It is quite common that more and more people can watch exhibitions through television or internet at home due to modern technology; therefore, some people think museums and art galleries will disappear soon. Although modern technology make it possible, I still believe some museums and art galleries will not disappear.",modern technology has provided a more convenient and comfortable manner for people to watch exhibitions,1360,1463
1,2,"It is always said that competition can effectively promote the development of economy. In order to survive in the competition, companies continue to improve their products and service, and as a result, the whole society prospers. However, when we discuss the issue of competition or cooperation, what we are concerned about is not the whole society, but the development of an individual's whole life. From this point of view, I firmly believe that we should attach more importance to cooperation during primary education.","Take Olympic games which is a form of competition for instance, it is hard to imagine how an athlete could win the game without the training of his or her coach, and the help of other professional staffs such as the people who take care of his diet, and those who are in charge of the medical care",1549,1846
1,4,"The last decade has seen an increasing number of tourists travelling to visit natural wonder sights, ancient heritages and different cultures around the world. While some people might think that this international tourism has negative effects on the destination countries, I would contend that it has contributed to the economic development as well as preserved the culture and environment of the tourist destinations.",it has contributed to the economic development as well as preserved the culture and environment of the tourist destinations,353,476
1,4,"Unemployment is clearly a global problem, be it in developed countries or developing ones. However, I tend to believe it is the responsibility of these disadvantaged citizens, rather than the government, to help them out.",direct financial support may not be a wise option,1519,1568
1,4,"The purpose of this essay is to discuss what can students and the organizations benefit from the activity that the students sent by their schools to work for companies without salaries. In this essay, I would start by analyzing the advantages for doing this for both students and companies, and then I would draw a conclusion at the end.","they can start looking for potential employees and begin the training, therefore save the time and resources for searching new staffs and organizing an orientation",1213,1376
1,4,"The purpose of this essay is to discuss whether or not the only way to motivate employees to be more hard-working and productive is by raising their salaries. In this essay, I would start by analyzing the factors for higher yields and finish by stating my position on this.",creating an enjoyable working environment is more realistic and essential if one wishes an increase in productivity and better employee performances,1055,1203
1,4,"In our modern times, with the development of science and technology, our living standard has been improved beyond recognition. Technology, however, is not the best solution to all the world's intricate problems. Accordingly, it is believed that we need to place less emphasis on technological solutions and more on other values, such as economy, politics and education. Personally, I partly disagree with this point of view, and the reasons are given below.",it can contribute greatly to the development of the world,1848,1905
1,2,"The modern society is full of cut-throat competition. Some people think that inculcating co-operative approach in a child is essential while some think that competing is the best way to succeed. However, co-operative approach always helps a child to become a responsible adult with good moral values and a friendly social circle.","When co-operation and healthy competition is followed together, success, achievements, recognition and any goal becomes easier",2198,2324
1,4,"Man has dominated all his fellow beings on earth because of his superior brain. He has domesticated a large number of animals and birds and makes use of them to make life easier and convenient for himself. Many people encourage the use of animals for their personal needs, while others are concerned that animals should not be misused. This essay will discuss some arguments for and against animal domestication.",human being should behave as a guardian to animals,1591,1641
1,4,"Nowadays, the popularity of mobile phones has brought about a lot of convenience but at the meanwhile a variety of problems as well, such as social, medical and technical problems. However, I do not think these disadvantages will outweigh the advantages brought by cell phones. In this essay, I would like to analyse these three issues in order to support my viewpoint.",I do not think these disadvantages will outweigh the advantages brought by cell phones,216,302
1,2,Is marijuana as bad as society makes it out to be? Since the 1930's marijuana has been illegal in the United States. That being said it's somehow America's number one cash crop. Users of the drug aren't the only ones who support cannabis; many of us who do not indulge are pro-legalization because we see that prohibition does more harm than good.,"It's done nothing but waste tax payer dollars, fill prisons with non violent criminals, and create a black market",1071,1184
1,2,"Technology, in the past two hundred years, has taken a dramatic progress in many fields of our society, such as telecommunications, manufacturing and buildings, etc. Certainly, technologies have also contributed to the great change of our daily lives. However, today some people consider that the range of technology regarding of public has a negative effect on increasing the gap between rich and poor. Personally, I find it hard for me to agree with this opinion by the following reasons.","Nowadays, we can talk with our friends online, no matter where we are and how far between us",1505,1597
1,2,"Computer-a device which has given a whole new dimension to the human life. Ever since Charles Babbage (know as ""Father of computers"") invented computers, its development never had a pause. The whole world is dependent on computers, without which, the world will go back hundreds of years.","Virus programs, privacy breach, leak of confidential documents, cyber attacks, identity theft, frauds etc. are some of its demerits, from a countless list",1389,1543
1,2,"The last decade has seen an increasing number of tourists travelling to visit natural wonder sights, ancient heritages and different cultures around the world. While some people might think that this international tourism has negative effects on the destination countries, I would contend that it has contributed to the economic development as well as preserved the culture and environment of the tourist destinations.","Without this support and profit from tourism, many traditional cultures would disappear due to its low income works",1332,1447
1,2,"Despite the development of modern society, the health care and education still remain the basic rights of citizens. And a much debated issue these days is whether or not the government should be responsible for citizens' health care and education.",the harmonious society calls for the joint efforts of the government and citizens,1962,2043
1,2,"Nowadays, we can see advertisements everywhere, from television set to posters on the streets. Some people believe that these various advertisements get people to buy products that are unnecessary and only look good on television. I tend to agree with this view.",Otherwise the market may be monopolistic,1359,1399
1,4,"Children tend to visit zoos where various kinds of wild creatures could be seen. When it comes to whether zoos should exist on contemporary society, animal-right activists strongly recommended that wildlife belong to natural environment and zoos should be banned. I would not go along with their viewpoint as zoos have irreplaceable benefits in terms of animal preservation and children education.",What the zoos should do is improvement of the management system and use the income wisely in preserving wild animals better,2009,2132
1,4,"More than 1.6 billion people in the world are either overweight or obese and United States has the highest rate of obesity. America's number one killer is cardiovascular diseases, which can easily be prevented by exercising. Exercise not only reduces the risk of health problems and various diseases, but it also has an effect on overall appearance. It is proven that exercising and being active can improve self-esteem and confidence. Excerising is one of the most important things in life and it can even be fun. It is a crucial element for living a healthier, longer, and happier life.",It is one of the most important things in life,3306,3352
1,2,"Currently, a great number of countries have pushed forward their economies by developing national industries. However, some people are worried that the economic targets in industrialized countries may be attained at the expense of the ecosystems. From my perspective, I think flourishing economies can go hand in hand with environmental preservation.","some countries may place economic developments ahead of environmental protection, thus ruining the local environments",400,517
1,4,"Man has dominated all his fellow beings on earth because of his superior brain. He has domesticated a large number of animals and birds and makes use of them to make life easier and convenient for himself. Many people encourage the use of animals for their personal needs, while others are concerned that animals should not be misused. This essay will discuss some arguments for and against animal domestication.",Human being has driven many animals for their personal use,474,532
1,2,"There is not a single piece of history that determines whether or not same sex marriage is right or wrong. There is absolutely no legal, logical, or governing reason that same sex couples cannot be wed and it's extremely unconstitutional in every way to tell them they can't. Same sex marriage should be legal for a number of reasons, a few being, it's no one else's business if two men or two women want to get married, not allowing them to marry makes them seem inferior, and it rids them of their civil rights.","Just like you didn't choose who you love, neither did they",1768,1826
1,2,"In the present age, it is a matter of fact that increasing minority languages have diminished from the world due to the proliferation of English. Some people claim it's a reasonable loss in globalization while others argue the demerits exceed the merits. Personally, I agree with the former opinion.","It's neither to get a translated version of these articles, nor to always have a translator besides",1100,1199
1,4,"Camping can take on many definitions. Camping to one person can mean seclusion in the middle of a forest. Another individual might think camping as a motor home with all the amenities of their house, including the kitchen sink. Whatever the definition is, camping is an experience that should be tried by everyone.",That difference in price can make a camping trip a good possibility while keeping the overall costs down to a minimum,1959,2076
1,2,"With the rapid development of the standard of people's life, increasing numbers of animal experiments are done, new medicines and foods, for instance. Some opponents says that it is cruel to animals and nature, however, I believe that no sensible person will deny that it is a dramatically cruel activity to humanity if the latest foods or medicines are allowed to sold without testing on animals. In my essay, I will discuss this issue from twofold aspects.",The new foods or medicines are invented to promote the quantity of human's life,1221,1300
1,4,"Man has dominated all his fellow beings on earth because of his superior brain. He has domesticated a large number of animals and birds and makes use of them to make life easier and convenient for himself. Many people encourage the use of animals for their personal needs, while others are concerned that animals should not be misused. This essay will discuss some arguments for and against animal domestication.",manipulation of them should be punished as a serious crime,1740,1798
1,4,"The modern society is full of cut-throat competition. Some people think that inculcating co-operative approach in a child is essential while some think that competing is the best way to succeed. However, co-operative approach always helps a child to become a responsible adult with good moral values and a friendly social circle.","An individual must compete with oneself only, instead of trying to beat others",1272,1350
1,4,"The purpose of this essay is to discuss what can students and the organizations benefit from the activity that the students sent by their schools to work for companies without salaries. In this essay, I would start by analyzing the advantages for doing this for both students and companies, and then I would draw a conclusion at the end.",students can learn invaluable experiences through the period of time working for the institutions they are assigned to,388,506
