class,argtype,text,argtypetext,argtypetextstart,argtypetextend
1,2,"The modern times have witnessed profound changes in most aspects of life, including the revolution of feminism. Women have been opened up to more chances than ever. This, contrary to some ideas, is a positive progress in human society from my point of view.",children might enjoy less care from parents as they arre both busy with theit work,1545,1627
1,4,"The last 50 years have seen an increasing number of immigrants to other countries. People moved due to a number of reasons, namely better educations or higher salary jobs. Some people thought that they should follow the local customs in order to integrate into their adopted countries’ cultures. However I strongly believe that they are able to sustain their cultural identities and doing so help they keep their origin values.",they should follow the local customs in order to integrate into their adopted countries’ cultures,260,357
1,2,"It is certainly true that some languages are disappearing day by day over the world. Some people, therefore, harbour a view saying that governments should preserve those by spending some budgets on them. But the others do not believe it is possible. In my opinion, this viewpoint needs to be examined thoroughly and this essay will discuss this issue.","If they do not try their best, their protection can be halted and waste of money",1465,1545
1,2,"Education is important for the development of the world. Its a debatable issue whether universities should accept equal number of males and females in a course or not. However, since both genders are equally important, both must be given equal opportunities. Universities must admit both in equal numbers, depending on their choices.",a healthy competitive environment will develop,694,740
1,2,"International sporting events are a good change to create a multi-nation community of fans having the same passion. It will help people around the world understand each other more. Since, international sporting occasions are essential in easing international tensions and releasing patriotic emotions in a safe way.",It is rare times when people can learn about this country,943,1000
1,4,"Nowadays, whether to establish large factories nearby housing areas has become a controversial issue in our society. Out of the case of economic development, industrial buildings are a necessary part of modern society. However a vast number of people are against building a factory near their community because of pollution. From my point of view, the advantages of building a factory will outweigh its disadvantages, if we tackle the environmental problems brought by factories.",a large factory can stimulate local economic growth and reduce the unemployment rate,522,606
1,2,"Crime is always punishable. Retribution is the method for countering criminals. Some countries have stringent rules, like capital punishment, while other have a lot of flexibility in the judicial system. However, strict laws, like capital punishment, are essential in a society.",capital punishment saves a lot of government funding which is wasted in maintenance of these hardcore criminals,917,1028
1,2,The soaring crime rate has led to the proposal that it is time for the government to take action to control the proliferation of violent scenes in media.,"media, such as TV or film, is considered as the correct information source regulated by the government",628,730
1,2,"International sporting events are a good change to create a multi-nation community of fans having the same passion. It will help people around the world understand each other more. Since, international sporting occasions are essential in easing international tensions and releasing patriotic emotions in a safe way.","in FIFA World Cup 2010, the relation between North Korea and South Korea is dangerous for the warship sinking",699,808
1,2,The soaring crime rate has led to the proposal that it is time for the government to take action to control the proliferation of violent scenes in media.,"Violence, as one of the facts in the real world, certainly has to be reported",802,879
1,2,"With the rapid development of the standard of people's life, increasing numbers of animal experiments are done, new medicines and foods, for instance. Some opponents says that it is cruel to animals and nature, however, I believe that no sensible person will deny that it is a dramatically cruel activity to humanity if the latest foods or medicines are allowed to sold without testing on animals. In my essay, I will discuss this issue from twofold aspects.",animals are friendly and vital for people,540,581
1,2,"How to allocate governmental budget efficiently has always been a hot topic of discussion among the public. Recently, some people argue that government should invest more on medical care and education rather than on entertaining or sports facilities. As far as I am concerned, this proposal is beneficial more to the society.","Entertaining facilities such as cinemas, theaters and sports stadiums are mostly profit-oriented",848,944
1,4,"There is not a single piece of history that determines whether or not same sex marriage is right or wrong. There is absolutely no legal, logical, or governing reason that same sex couples cannot be wed and it's extremely unconstitutional in every way to tell them they can't. Same sex marriage should be legal for a number of reasons, a few being, it's no one else's business if two men or two women want to get married, not allowing them to marry makes them seem inferior, and it rids them of their civil rights.",Same sex marriage being illegal rids the couple of their civil rights,2439,2508
1,2,"Why shouldn't schools do locker checks? Why do many students oppose locker checks? Random locker checks are not done to torment and/or invade the privacy of the students, but for many other important reasons which include school security. These checks are required because malicious students bring drugs and weapons to school and store them in the lockers. Random locker checks should be made obligatory and done frequently to assure the wellbeing of the students.",malicious students bring drugs and weapons to school and store them in the lockers,288,370
1,4,"Many people believe that children should study at school to have more knowledge that prepare better for their future. Others, however, think that these children may disrupt their school work and should be allowed to leave school early to find a job. Personally, I tend to agree with the point of view that student have to be forced to study at school.",student have to be forced to study at school,337,381
1,2,"Camping can take on many definitions. Camping to one person can mean seclusion in the middle of a forest. Another individual might think camping as a motor home with all the amenities of their house, including the kitchen sink. Whatever the definition is, camping is an experience that should be tried by everyone.",There are so many places both near and far that are best experienced by spending a few days within the place,2365,2473
1,2,"Why shouldn't schools do locker checks? Why do many students oppose locker checks? Random locker checks are not done to torment and/or invade the privacy of the students, but for many other important reasons which include school security. These checks are required because malicious students bring drugs and weapons to school and store them in the lockers. Random locker checks should be made obligatory and done frequently to assure the wellbeing of the students.","privacy will be invaded not only at school, so students have to accept it",2862,2935
1,2,"Currently, a great number of countries have pushed forward their economies by developing national industries. However, some people are worried that the economic targets in industrialized countries may be attained at the expense of the ecosystems. From my perspective, I think flourishing economies can go hand in hand with environmental preservation.","With people raising their awareness of the green economy, the products free of pollutants are increasingly prevalent among clients, which means eco-friendly businesses can make a favourable impression on customers today, triggering sales",1139,1376
1,4,"Over the last half century the change in the life of human begings has increased beyond our wildest expectations. There are countless new technological equipments flooding into our lives, such as the Internet, television and cell phone. They all enrich our daily lives.Now, many students learn from Internet after class and they find it quite helpful.",students learn far more from their teachers than from other source,1519,1585
1,2,"Personally, I believe that married women nowadays have right to take up jobs like men when employment discrimination based on gender have been erased significantly. Working outside home will bring a lot of benefits to both married woman and their household. I will mention some basic reasons as following.",employment discrimination based on gender have been erased significantly,140,212
1,4,"It is no secret that advertising become inseparable part of our modern life. We come across with ads almost everywhere and everyday. Some people argue that companies by advertising their goods or services spend their money for nothing. Other critics say that ads have no purpose, they only cause damages to society and all forms of advertising should be banned.","not only many businesses, but also governments have to rely on advertising",1322,1396
1,2,Air pullution is an issue threatening the enviorement in many different ways such as causing holes in the ozone and affecting global heating in the nagitve way. I believe that more reponsibilities should put on private individuals and companies such as paying to clean up air pollution.,they should be responsible from cleaning up the air pollution,1783,1844
1,2,"Modern communication technologies such as mobile phones, e-mails and internet chat programs like the MSN Messenger have brought significant changes to our lives in recent years. Yet, there remains some disagreement as to whether the overall effect of this innovation has been positive or negative. Although there are valid arguments to the contrary, it is my belief that the majority of people in the globe have benefited greatly from these powerful and effective means of modern communication.",only the more privileged are able to enjoy the benefits,1276,1331
1,2,"Nowadays, the world includes developing countries and developed countries. The difference between them is amount of money that governments use in critical areas such as commerce, health, education. The poor countries are buried in debts which are caused by loans they borrowed from The World Bank and the rich countries. To ease this difference and help the less fortune countries, the richer countries should take efforts in improving important areas in the less fortune countries.",The poor countries are buried in debts which are caused by loans they borrowed from The World Bank and the rich countries,242,363
1,4,"With the development of globalization, English became the dominated language in national trade, conference and many important events. This phenomenon has aroused a heated discussion in public.",we still need preserve other languages for sake of keeping the linguistic and cultural diversity,1655,1751
1,4,"How to allocate governmental budget efficiently has always been a hot topic of discussion among the public. Recently, some people argue that government should invest more on medical care and education rather than on entertaining or sports facilities. As far as I am concerned, this proposal is beneficial more to the society.",budgets should be allocated more on medical care and education rather than on building entertaining facilities,1916,2026
1,2,"With the booming development of some cosmopolitan metropolises in recent years, an increasing number of people are flooding into these major cities, raising such urban problems as traffic jams or housing shortage. In such cases, some people think an effective way to tackle these problems is to relocate big firms, factories and their employees in cities to the countryside. However, from my perspective, I suppose this suggestion is not advisable, for it cannot alter the situation essentially and instead it may give rise to new concerns in rural areas.","As people work in the countryside, they will not have to commute in cities at peak times such as eight o'clock in the morning or six o'clock in the afternoon",769,926
1,2,"Camping can take on many definitions. Camping to one person can mean seclusion in the middle of a forest. Another individual might think camping as a motor home with all the amenities of their house, including the kitchen sink. Whatever the definition is, camping is an experience that should be tried by everyone.",These well planned meals are sometimes the best meals that campers have ever had,4204,4284
1,2,"Camping can take on many definitions. Camping to one person can mean seclusion in the middle of a forest. Another individual might think camping as a motor home with all the amenities of their house, including the kitchen sink. Whatever the definition is, camping is an experience that should be tried by everyone.",Campers need to think out their meals thoroughly prior to making a trip,4131,4202
1,2,"Artists in most countries are given the freedom to express their thoughts in whatever they do. Nevertheless, some argue that there should be government restrictions in order to limit their opinions. I however, agree to this only to a certain extent and believe that the artists must be given freedom so that they will produce some really marvelous masterpiece.",they will produce some really marvelous masterpiece,343,394
1,2,The soaring crime rate has led to the proposal that it is time for the government to take action to control the proliferation of violent scenes in media.,our society is occupied with the violent scenes and plots at present,1308,1376
1,2,"Nowadays, the use of advertisement through different forms of media such as newspapers, radio and television has become very prevalent, so it is thought to be a necessary part of today's society. Many believe that advertising has brought great benefits to lives therefore it should be considered a positive activity while others have held a complete different idea about this. Both views will be critiqued before a reasonable conclusion is drawn.",advertising has brought great benefits to lives,268,315
1,2,"Today, the rate of unemployment is on the rise and is seriously being debated by many. Some opine that the best method to minimize this problem is by providing the unemployed with hand phones that have access to the Internet. They also believe that this solution is the most appropriate way to utilize the public money. Nevertheless, I agree to this solution only to a certain degree because I feel that giving those with no work a mobile phone each is a total waste of money.",the mobile phones can also be used to make calls with the companies in which they would like to work with,964,1069
1,2,"Presently, it is commonly accepted that students have to learn over eight subjects in school. Public retain differing views on whether to teach students all subjects or just focus on one subject. Some parents are satisfied with the full class schedule of their children. While, others claim that studying only one subject is more effective. Before rendering my own opinion, I will explore sides of this topic.","In students' point of view, the combination of difficult and easy subjects balances their schoolwork stress and fosters their enthusiasm on classes",779,926
1,4,"Today, we no longer fear any contagious diseases, kudos to modern technology and medical advancement. However, it is the contagious behaviors such as addiction and the wrong abuse of drugs that continue to terrorize our society, especially the young ones. It is undeniable that drug addiction is indeed on the rise and effective solutions must be taken in order to trim down the number of drug addicts. Some suggest that it would be better if those caught red-handed using drugs be imprisoned. In my opinion, I disagree to the aforementioned resolution due to the reasons that I will put forward below.",some of the addicts do turn over a new leaf at the prison,706,763
1,2,"The last 50 years have seen an increasing number of immigrants to other countries. People moved due to a number of reasons, namely better educations or higher salary jobs. Some people thought that they should follow the local customs in order to integrate into their adopted countries’ cultures. However I strongly believe that they are able to sustain their cultural identities and doing so help they keep their origin values.","These feedbacks, in turn, help raise one’s pride of their cultures and help people understand each other more",948,1057
1,2,"The purpose of this essay is to discuss whether or not the only way to motivate employees to be more hard-working and productive is by raising their salaries. In this essay, I would start by analyzing the factors for higher yields and finish by stating my position on this.",junior high school teachers have great responsibility not only for students' private lives as they are going through adolescence but also their school work due to the fact that it is an important phase for them to study hard and get into the high school they want,549,812
1,4,"Preserving wild animals in zoos is an issue which frequently generates a great deal of heated debate, with supporters maintaining that wild life would be taken good care from professionals, while opponents claim that the animals are deprived of freedom as a result of staying in zoos. From my perspective, animals should live in natural habitats instead of zoos.",wild animals should be set free from zoos,1757,1798
1,4,"Today, the rate of unemployment is on the rise and is seriously being debated by many. Some opine that the best method to minimize this problem is by providing the unemployed with hand phones that have access to the Internet. They also believe that this solution is the most appropriate way to utilize the public money. Nevertheless, I agree to this solution only to a certain degree because I feel that giving those with no work a mobile phone each is a total waste of money.",I agree to this solution only to a certain degree,374,423
1,4,"The modern society is full of cut-throat competition. Some people think that inculcating co-operative approach in a child is essential while some think that competing is the best way to succeed. However, co-operative approach always helps a child to become a responsible adult with good moral values and a friendly social circle.",competition is also as important as co-operation,1142,1190
1,2,"Camping can take on many definitions. Camping to one person can mean seclusion in the middle of a forest. Another individual might think camping as a motor home with all the amenities of their house, including the kitchen sink. Whatever the definition is, camping is an experience that should be tried by everyone.",Spending time camping is a great way to revitalize the lungs,781,841
1,2,"Presently, it is commonly accepted that students have to learn over eight subjects in school. Public retain differing views on whether to teach students all subjects or just focus on one subject. Some parents are satisfied with the full class schedule of their children. While, others claim that studying only one subject is more effective. Before rendering my own opinion, I will explore sides of this topic.","with some basic knowledge of diverse fields, students have more options in choosing specialized areas or jobs in the future",568,691
1,4,"Today, the rate of unemployment is on the rise and is seriously being debated by many. Some opine that the best method to minimize this problem is by providing the unemployed with hand phones that have access to the Internet. They also believe that this solution is the most appropriate way to utilize the public money. Nevertheless, I agree to this solution only to a certain degree because I feel that giving those with no work a mobile phone each is a total waste of money.",supplying hand phones to the unemployed is a waste of the taxpayers' money,1276,1350
1,2,"Never in history was advertising industry so developed as in modern society and it has led to some adverse sentiments in public because some deliver exaggerated and fake information. Hence whether we should ban all the advertisements or not has aroused much controversy of the public. My view is that while some of them are disturbing, we can not overlook other merits the advertisements bring.",its merits still outweigh these downsides,1389,1430
1,2,"In our modern times, with the development of science and technology, our living standard has been improved beyond recognition. Technology, however, is not the best solution to all the world's intricate problems. Accordingly, it is believed that we need to place less emphasis on technological solutions and more on other values, such as economy, politics and education. Personally, I partly disagree with this point of view, and the reasons are given below.",its advantages clearly outweigh its disadvantages,1788,1837
1,2,"Innovative artists bring enjoyment and inspiration to our sometimes tedious life; however, some people deem that artists have been entrusted with too much freedom and power and should be restricted by the government. It is my personal belief that freedom of expressing thoughts and ideas should always be eulogized and it's rather iniquitous to impose a shackle on artists' will to create.","regardless of whether the work of art is based on truth or not, it is the public's authority to determine how to interpret its meaning",783,917
1,4,"Crime is always punishable. Retribution is the method for countering criminals. Some countries have stringent rules, like capital punishment, while other have a lot of flexibility in the judicial system. However, strict laws, like capital punishment, are essential in a society.","Criminals who don't have any chance of improvement or who have a past record of such crimes are, therefore, given capital punishment",1030,1162
1,2,"Recently, a great deal of attention has been paid to means of transportation. Some state that automobile is the most convenient transportation, while others assert that alternative forms of transport should be considered in view of environmental pollution. In my opinion, I strongly agree that alternative means of transportation and international laws in controlling automobiles should be introduced. In this essay, several reasons will be described carefully in the following passages.",rental bicycle system has been introduced in several European countries,1638,1709
1,2,"Studies are an essential part of life.Some countries permit students to take a break from studies between high school and university studies, while in some countries, it is considered as waste of time. However, a break of one year is good for young people after finishing their high school.",One year break can help young people to prepare for the challenges of life,2358,2432
1,4,"Primary and secondary education provide a basic knowledge and skills to the people in this world. I completely agree that government should provide those education to their people; however, for the more higher education like university, the students or their parents should pay for the fees.","for the more higher education like university, the students or their parents should pay for the fees",216,316
1,2,"Studies are an essential part of life.Some countries permit students to take a break from studies between high school and university studies, while in some countries, it is considered as waste of time. However, a break of one year is good for young people after finishing their high school.",they go in a utopia,1577,1596
1,4,"Studies are an essential part of life.Some countries permit students to take a break from studies between high school and university studies, while in some countries, it is considered as waste of time. However, a break of one year is good for young people after finishing their high school.","Countries, like India, where such a break is considered a blot, should understand that young minds are delicate and they face a cut-throat competition",2206,2356
1,2,"The differences between knowledge from books and from experience have erupted endless controversy. Various ideas and preferences have been presented. The purpose of my writing is to deeply discuss these sources of knowledge in two important aspects: accuracy and practicability, and to show my greater interest in knowledge accumulated from experience.",there is an increased likelihood that he neither remembers the necessary information for a long time nor knows how to do an make an experiment,1659,1801
1,2,"International sporting events are a good change to create a multi-nation community of fans having the same passion. It will help people around the world understand each other more. Since, international sporting occasions are essential in easing international tensions and releasing patriotic emotions in a safe way.","In Olympic Beijing 2008, Chinese tried thier best to bring the world a spectacular image about their country",1570,1678
1,4,"Camping can take on many definitions. Camping to one person can mean seclusion in the middle of a forest. Another individual might think camping as a motor home with all the amenities of their house, including the kitchen sink. Whatever the definition is, camping is an experience that should be tried by everyone.",Some of the people that can be met while camping can make the entire trip better,4630,4710
